{
  "schema_version": 1,
  "term": "2026-2027-1",
  "week": 2,
  "snapshot_id": "snap-2026-09-02-week-02",
  "generated_at": "2026-09-02T04:10:00+08:00",
  "last_success_at": "2026-09-02T04:10:00+08:00",
  "days": {
    "1": {
      "rooms": [
        {
          "jsbh": "0101",
          "group_id": "zong-he-jiao-xue-lou",
          "name": "综合教学楼101",
          "statuses": {
            "10": 5,
            "11": 5,
            "12": 5,
            "01": 5,
            "02": 5,
            "03": 5,
            "04": 5,
            "05": 5,
            "06": 5,
            "07": 5,
            "08": 5,
            "09": 5
          }
        },
        {
          "jsbh": "0102",
          "group_id": "zong-he-jiao-xue-lou",
          "name": "综合教学楼102",
          "statuses": {
            "10": 5,
            "11": 5,
            "12": 5,
            "01": 5,
            "02": 5,
            "03": 5,
            "04": 5,
            "05": 1,
            "06": 5,
            "07": 5,
            "08": 5,
            "09": 5
          }
        },
        {
          "jsbh": "0103",
          "group_id": "zong-he-jiao-xue-lou",
          "name": "文史楼201",
          "statuses": {
            "10": 8,
            "11": 8,
            "12": 8,
            "01": 8,
            "02": 8,
            "03": 8,
            "04": 8,
            "05": 8,
            "06": 8,
            "07": 8,
            "08": 8,
            "09": 8
          }
        },
        {
          "jsbh": "0104",
          "group_id": "zong-he-jiao-xue-lou",
          "name": "文史楼201",
          "statuses": {
            "10": 1,
            "11": 1,
            "12": 1,
            "01": 5,
            "02": 5,
            "03": 1,
            "04": 1,
            "05": 1,
            "06": 1,
            "07": 1,
            "08": 1,
            "09": 1
          }
        },
        {
          "jsbh": "0105",
          "group_id": "zong-he-jiao-xue-lou",
          "name": "F126",
          "statuses": {
            "10": 5,
            "11": 5,
            "12": 5,
            "01": 5,
            "02": 5,
            "03": 5,
            "04": 5,
            "05": 1,
            "06": 5,
            "07": 5,
            "08": 5,
            "09": 5
          }
        },
        {
          "jsbh": "0106",
          "group_id": "zong-he-jiao-xue-lou",
          "name": "综合教学楼202",
          "statuses": {
            "10": 5,
            "11": 5,
            "12": 5,
            "01": 5,
            "02": 5,
            "03": 5,
            "04": 5,
            "05": 5,
            "06": 5,
            "07": 5,
            "08": 5,
            "09": 5
          }
        },
        {
          "jsbh": "0201",
          "group_id": "ti-yu-guan",
          "name": "体育馆101",
          "statuses": {
            "10": 5,
            "11": 5,
            "12": 5,
            "01": 5,
            "02": 5,
            "03": 5,
            "04": 5,
            "05": 5,
            "06": 5,
            "07": 5,
            "08": 5,
            "09": 5
          }
        },
        {
          "jsbh": "0202",
          "group_id": "ti-yu-guan",
          "name": "体育馆201",
          "statuses": {
            "10": 8,
            "11": 8,
            "12": 8,
            "01": 8,
            "02": 8,
            "03": 8,
            "04": 8,
            "05": 8,
            "06": 8,
            "07": 8,
            "08": 8,
            "09": 8
          }
        }
      ]
    },
    "2": {
      "rooms": [
        {
          "jsbh": "0101",
          "group_id": "zong-he-jiao-xue-lou",
          "name": "综合教学楼101",
          "statuses": {
            "10": 5,
            "11": 5,
            "12": 5,
            "01": 5,
            "02": 5,
            "03": 5,
            "04": 5,
            "05": 5,
            "06": 5,
            "07": 5,
            "08": 5,
            "09": 5
          }
        },
        {
          "jsbh": "0102",
          "group_id": "zong-he-jiao-xue-lou",
          "name": "综合教学楼102",
          "statuses": {
            "10": 5,
            "11": 5,
            "12": 5,
            "01": 5,
            "02": 5,
            "03": 5,
            "04": 5,
            "05": 1,
            "06": 5,
            "07": 5,
            "08": 5,
            "09": 5
          }
        },
        {
          "jsbh": "0103",
          "group_id": "zong-he-jiao-xue-lou",
          "name": "文史楼201",
          "statuses": {
            "10": 8,
            "11": 8,
            "12": 8,
            "01": 8,
            "02": 8,
            "03": 8,
            "04": 8,
            "05": 8,
            "06": 8,
            "07": 8,
            "08": 8,
            "09": 8
          }
        },
        {
          "jsbh": "0104",
          "group_id": "zong-he-jiao-xue-lou",
          "name": "文史楼201",
          "statuses": {
            "10": 1,
            "11": 1,
            "12": 1,
            "01": 5,
            "02": 5,
            "03": 1,
            "04": 1,
            "05": 1,
            "06": 1,
            "07": 1,
            "08": 1,
            "09": 1
          }
        },
        {
          "jsbh": "0105",
          "group_id": "zong-he-jiao-xue-lou",
          "name": "F126",
          "statuses": {
            "10": 5,
            "11": 5,
            "12": 5,
            "01": 5,
            "02": 5,
            "03": 5,
            "04": 5,
            "05": 1,
            "06": 5,
            "07": 5,
            "08": 5,
            "09": 5
          }
        },
        {
          "jsbh": "0106",
          "group_id": "zong-he-jiao-xue-lou",
          "name": "综合教学楼202",
          "statuses": {
            "10": 5,
            "11": 5,
            "12": 5,
            "01": 5,
            "02": 5,
            "03": 5,
            "04": 5,
            "05": 5,
            "06": 5,
            "07": 5,
            "08": 5,
            "09": 5
          }
        },
        {
          "jsbh": "0201",
          "group_id": "ti-yu-guan",
          "name": "体育馆101",
          "statuses": {
            "10": 5,
            "11": 5,
            "12": 5,
            "01": 5,
            "02": 5,
            "03": 5,
            "04": 5,
            "05": 5,
            "06": 5,
            "07": 5,
            "08": 5,
            "09": 5
          }
        },
        {
          "jsbh": "0202",
          "group_id": "ti-yu-guan",
          "name": "体育馆201",
          "statuses": {
            "10": 8,
            "11": 8,
            "12": 8,
            "01": 8,
            "02": 8,
            "03": 8,
            "04": 8,
            "05": 8,
            "06": 8,
            "07": 8,
            "08": 8,
            "09": 8
          }
        }
      ]
    },
    "3": {
      "rooms": [
        {
          "jsbh": "0101",
          "group_id": "zong-he-jiao-xue-lou",
          "name": "综合教学楼101",
          "statuses": {
            "10": 5,
            "11": 5,
            "12": 5,
            "01": 5,
            "02": 5,
            "03": 5,
            "04": 5,
            "05": 5,
            "06": 5,
            "07": 5,
            "08": 5,
            "09": 5
          }
        },
        {
          "jsbh": "0102",
          "group_id": "zong-he-jiao-xue-lou",
          "name": "综合教学楼102",
          "statuses": {
            "10": 5,
            "11": 5,
            "12": 5,
            "01": 5,
            "02": 5,
            "03": 5,
            "04": 5,
            "05": 1,
            "06": 5,
            "07": 5,
            "08": 5,
            "09": 5
          }
        },
        {
          "jsbh": "0103",
          "group_id": "zong-he-jiao-xue-lou",
          "name": "文史楼201",
          "statuses": {
            "10": 8,
            "11": 8,
            "12": 8,
            "01": 8,
            "02": 8,
            "03": 8,
            "04": 8,
            "05": 8,
            "06": 8,
            "07": 8,
            "08": 8,
            "09": 8
          }
        },
        {
          "jsbh": "0104",
          "group_id": "zong-he-jiao-xue-lou",
          "name": "文史楼201",
          "statuses": {
            "10": 1,
            "11": 1,
            "12": 1,
            "01": 5,
            "02": 5,
            "03": 1,
            "04": 1,
            "05": 1,
            "06": 1,
            "07": 1,
            "08": 1,
            "09": 1
          }
        },
        {
          "jsbh": "0105",
          "group_id": "zong-he-jiao-xue-lou",
          "name": "F126",
          "statuses": {
            "10": 5,
            "11": 5,
            "12": 5,
            "01": 5,
            "02": 5,
            "03": 5,
            "04": 5,
            "05": 1,
            "06": 5,
            "07": 5,
            "08": 5,
            "09": 5
          }
        },
        {
          "jsbh": "0106",
          "group_id": "zong-he-jiao-xue-lou",
          "name": "综合教学楼202",
          "statuses": {
            "10": 5,
            "11": 5,
            "12": 5,
            "01": 5,
            "02": 5,
            "03": 5,
            "04": 5,
            "05": 5,
            "06": 5,
            "07": 5,
            "08": 5,
            "09": 5
          }
        },
        {
          "jsbh": "0201",
          "group_id": "ti-yu-guan",
          "name": "体育馆101",
          "statuses": {
            "10": 5,
            "11": 5,
            "12": 5,
            "01": 5,
            "02": 5,
            "03": 5,
            "04": 5,
            "05": 5,
            "06": 5,
            "07": 5,
            "08": 5,
            "09": 5
          }
        },
        {
          "jsbh": "0202",
          "group_id": "ti-yu-guan",
          "name": "体育馆201",
          "statuses": {
            "10": 8,
            "11": 8,
            "12": 8,
            "01": 8,
            "02": 8,
            "03": 8,
            "04": 8,
            "05": 8,
            "06": 8,